{
  "$schema": "https://json-schema.org/draft/2020-12/schema",
  "$id": "https://mcpconform.dev/schemas/profile.schema.json",
  "title": "mcpconform consumer profile",
  "description": "Declarative capability profile for a tool-definition CONSUMER — an LLM-provider tool-use API (Anthropic, OpenAI, Gemini, ...) or an MCP host (Claude Desktop, Cursor, ...). mcpconform is provider-agnostic: every consumer, including the MCP spec itself, is described by one of these files. No vendor is privileged in the engine; the generic provider/* rule family reads whichever profile(s) the run targets.",
  "type": "object",
  "required": ["id", "kind", "verified"],
  "additionalProperties": false,
  "patternProperties": { "^_": { "description": "Keys starting with _ are free-form comments (e.g. _comment), ignored by the engine." } },
  "properties": {
    "$schema": { "type": "string" },
    "id": { "type": "string", "pattern": "^[a-z0-9][a-z0-9-]*$" },
    "displayName": { "type": "string" },
    "kind": {
      "enum": ["llm-provider", "mcp-host", "synthetic", "spec-baseline"],
      "description": "synthetic = a computed intersection (e.g. generic-strict). spec-baseline = an MCP spec revision modelled as a profile."
    },
    "verified": {
      "type": "boolean",
      "description": "true ONLY when every constraint below was read from the consumer's own documentation (cited in `source`). Findings that rely on a verified:false profile are flagged by meta/profile-unverified so a guessed number never reads as gospel."
    },
    "source": { "type": "string", "description": "URL(s) of the doc the constraints came from. Required when verified=true." },
    "lastVerified": { "type": "string", "format": "date" },
    "notes": { "type": "string" },

    "toolName": {
      "type": "object",
      "additionalProperties": false,
      "patternProperties": { "^_": {} },
      "properties": {
        "pattern": { "type": "string", "description": "ECMA regex the full tool name must match." },
        "maxLength": { "type": ["integer", "null"] },
        "caseSensitive": {
          "type": "boolean",
          "default": true,
          "description": "false = the consumer matches tool names case-insensitively, so names that differ only by case collide (provider/name-case-collision)."
        }
      }
    },
    "toolDescription": {
      "type": "object",
      "additionalProperties": false,
      "patternProperties": { "^_": {} },
      "properties": { "maxLength": { "type": ["integer", "null"], "description": "null = no documented cap." } }
    },
    "tools": {
      "type": "object",
      "additionalProperties": false,
      "patternProperties": { "^_": {} },
      "properties": {
        "maxCount": { "type": ["integer", "null"], "description": "Max number of tool definitions accepted in one request." },
        "maxTotalBytes": { "type": ["integer", "null"], "description": "Budget on the serialized tool set, if the consumer documents one." }
      }
    },
    "inputSchema": {
      "type": "object",
      "additionalProperties": false,
      "patternProperties": { "^_": {} },
      "properties": {
        "dialect": { "enum": ["draft-2020-12", "draft-07", "openapi-3.0", "subset"] },
        "rootMustBeObject": {
          "type": "boolean",
          "deprecated": true,
          "description": "Deprecated and ignored: the MCP spec already requires an object root, which the core rule tool/input-schema-root-object enforces for every target. Accepted only so existing custom profiles still validate."
        },
        "supportedKeywords": {
          "type": "array",
          "items": { "type": "string" },
          "description": "ALLOWLIST. If present, any JSON-Schema keyword NOT in this list is treated as unsupported. Use for allowlist consumers like Gemini's OpenAPI subset."
        },
        "unsupportedKeywords": {
          "type": "array",
          "items": { "type": "string" },
          "description": "DENYLIST of keywords the consumer rejects (error)."
        },
        "unenforcedKeywords": {
          "type": "array",
          "items": { "type": "string" },
          "description": "Constraint keywords accepted but not applied (won't constrain model output) — flagged at info by default, promoted to error when a strict mode rejects them."
        },
        "ignoredKeywords": {
          "type": "array",
          "items": { "type": "string" },
          "description": "Keywords the consumer silently drops with no error (e.g. additionalProperties/default on Gemini). Flagged at info, never error — distinguishes 'harmlessly ignored' from 'rejected'."
        },
        "supportedStringFormats": {
          "type": "array",
          "items": { "type": "string" },
          "description": "`format` values the consumer honors in strict mode. When strict.rejectsUnenforcedKeywords is true, `format` with one of these values is accepted in strict mode and any other value is rejected (provider/schema-unsupported-keyword). Default mode is unaffected."
        },
        "allowsRefs": { "type": "boolean" },
        "allowsRecursion": {
          "type": "boolean",
          "description": "false = recursive schemas (a $ref to \"#\", $dynamicRef/$recursiveRef, or a cycle among local $defs) are rejected (provider/schema-no-refs). Checked only when allowsRefs is not false — without $ref there is no recursion."
        },
        "allowsAnyOf": { "type": "boolean" },
        "maxNestingDepth": { "type": ["integer", "null"] },
        "maxProperties": {
          "type": ["integer", "null"],
          "description": "Max total object properties, summed over every object in the schema (provider/schema-max-properties)."
        }
      }
    },
    "strict": {
      "type": "object",
      "additionalProperties": false,
      "patternProperties": { "^_": {} },
      "description": "Extra constraints that apply ONLY when the consumer's strict / structured-output mode is enabled for this target (config: mode='strict').",
      "properties": {
        "requiresAdditionalPropertiesFalse": { "type": "boolean" },
        "requiresAllPropertiesRequired": { "type": "boolean" },
        "rejectsUnenforcedKeywords": { "type": "boolean" },
        "maxNestingDepth": { "type": ["integer", "null"] },
        "maxProperties": {
          "type": ["integer", "null"],
          "description": "Strict-mode max total object properties, summed over every object in the schema (provider/schema-max-properties)."
        }
      }
    }
  },
  "allOf": [
    {
      "if": { "properties": { "verified": { "const": true } }, "required": ["verified"] },
      "then": { "required": ["source", "lastVerified"] }
    }
  ]
}
